PassengerId,Survived,Pclass,Name,Sex,Age,SibSp,Parch,Ticket,Fare,Cabin,Embarked
622,1,1,"Kimball, Mr. Edwin Nelson Jr",male,42.0,1,0,11753,52.5542,D19,S
220,0,2,"Harris, Mr. Walter",male,30.0,0,0,W/C 14208,10.5,,S
229,0,2,"Fahlstrom, Mr. Arne Jonas",male,18.0,0,0,236171,13.0,,S
169,0,1,"Baumann, Mr. John D",male,,0,0,PC 17318,25.925,,S
408,1,2,"Richards, Master. William Rowe",male,3.0,1,1,29106,18.75,,S
748,1,2,"Sinkkonen, Miss. Anna",female,30.0,0,0,250648,13.0,,S
136,0,2,"Richard, Mr. Emile",male,23.0,0,0,SC/PARIS 2133,15.0458,,C
84,0,1,"Carrau, Mr. Francisco M",male,28.0,0,0,113059,47.1,,S
55,0,1,"Ostby, Mr. Engelhart Cornelius",male,65.0,0,1,113509,61.9792,B30,C
28,0,1,"Fortune, Mr. Charles Alexander",male,19.0,3,2,19950,263.0,C23 C25 C27,S
544,1,2,"Beane, Mr. Edward",male,32.0,1,0,2908,26.0,,S
558,0,1,"Robbins, Mr. Victor",male,,0,0,PC 17757,227.525,,C
868,0,1,"Roebling, Mr. Washington Augustus II",male,31.0,0,0,PC 17590,50.4958,A24,S
751,1,2,"Wells, Miss. Joan",female,4.0,1,1,29103,23.0,,S
343,0,2,"Collander, Mr. Erik Gustaf",male,28.0,0,0,248740,13.0,,S
192,0,2,"Carbines, Mr. William",male,19.0,0,0,28424,13.0,,S
399,0,2,"Pain, Dr. Alfred",male,23.0,0,0,244278,10.5,,S
214,0,2,"Givard, Mr. Hans Kristensen",male,30.0,0,0,250646,13.0,,S
725,1,1,"Chambers, Mr. Norman Campbell",male,27.0,1,0,113806,53.1,E8,S
271,0,1,"Cairns, Mr. Alexander",male,,0,0,113798,31.0,,S
315,0,2,"Hart, Mr. Benjamin",male,43.0,1,1,F.C.C. 13529,26.25,,S
44,1,2,"Laroche, Miss. Simonne Marie Anne Andree",female,3.0,1,2,SC/Paris 2123,41.5792,,C
473,1,2,"West, Mrs. Edwy Arthur (Ada Mary Worth)",female,33.0,1,2,C.A. 34651,27.75,,S
285,0,1,"Smith, Mr. Richard William",male,,0,0,113056,26.0,A19,S
145,0,2,"Andrew, Mr. Edgardo Samuel",male,18.0,0,0,231945,11.5,,S
842,0,2,"Mudd, Mr. Thomas Charles",male,16.0,0,0,S.O./P.P. 3,10.5,,S
459,1,2,"Toomey, Miss. Ellen",female,50.0,0,0,F.C.C. 13531,10.5,,S
306,1,1,"Allison, Master. Hudson Trevor",male,0.92,1,2,113781,151.55,C22 C26,S
448,1,1,"Seward, Mr. Frederic Kimber",male,34.0,0,0,113794,26.55,,S
240,0,2,"Hunt, Mr. George Henry",male,33.0,0,0,SCO/W 1585,12.275,,S
605,1,1,"Homer, Mr. Harry (""Mr E Haven"")",male,35.0,0,0,111426,26.55,,C
124,1,2,"Webber, Miss. Susan",female,32.5,0,0,27267,13.0,E101,S
467,0,2,"Campbell, Mr. William",male,,0,0,239853,0.0,,S
65,0,1,"Stewart, Mr. Albert A",male,,0,0,PC 17605,27.7208,,C
600,1,1,"Duff Gordon, Sir. Cosmo Edmund (""Mr Morgan"")",male,49.0,1,0,PC 17485,56.9292,A20,C
695,0,1,"Weir, Col. John",male,60.0,0,0,113800,26.55,,S
493,0,1,"Molson, Mr. Harry Markland",male,55.0,0,0,113787,30.5,C30,S
609,1,2,"Laroche, Mrs. Joseph (Juliette Marie Louise Lafargue)",female,22.0,1,2,SC/Paris 2123,41.5792,,C
652,1,2,"Doling, Miss. Elsie",female,18.0,0,1,231919,23.0,,S
516,0,1,"Walker, Mr. William Anderson",male,47.0,0,0,36967,34.0208,D46,S
42,0,2,"Turpin, Mrs. William John Robert (Dorothy Ann Wonnacott)",female,27.0,1,0,11668,21.0,,S
317,1,2,"Kantor, Mrs. Sinai (Miriam Sternin)",female,24.0,1,0,244367,26.0,,S
358,0,2,"Funk, Miss. Annie Clemmer",female,38.0,0,0,237671,13.0,,S
656,0,2,"Hickman, Mr. Leonard Mark",male,24.0,2,0,S.O.C. 14879,73.5,,S
418,1,2,"Silven, Miss. Lyyli Karoliina",female,18.0,0,2,250652,13.0,,S
324,1,2,"Caldwell, Mrs. Albert Francis (Sylvia Mae Harbaugh)",female,22.0,1,1,248738,29.0,,S
468,0,1,"Smart, Mr. John Montgomery",male,56.0,0,0,113792,26.55,,S
67,1,2,"Nye, Mrs. (Elizabeth Ramell)",female,29.0,0,0,C.A. 29395,10.5,F33,S
733,0,2,"Knight, Mr. Robert J",male,,0,0,239855,0.0,,S
571,1,2,"Harris, Mr. George",male,62.0,0,0,S.W./PP 752,10.5,,S
803,1,1,"Carter, Master. William Thornton II",male,11.0,1,2,113760,120.0,B96 B98,S
626,0,1,"Sutton, Mr. Frederick",male,61.0,0,0,36963,32.3208,D50,S
531,1,2,"Quick, Miss. Phyllis May",female,2.0,1,1,26360,26.0,,S
477,0,2,"Renouf, Mr. Peter Henry",male,34.0,1,0,31027,21.0,,S
773,0,2,"Mack, Mrs. (Mary)",female,57.0,0,0,S.O./P.P. 3,10.5,E77,S
414,0,2,"Cunningham, Mr. Alfred Fleming",male,,0,0,239853,0.0,,S
816,0,1,"Fry, Mr. Richard",male,,0,0,112058,0.0,B102,S
188,1,1,"Romaine, Mr. Charles Hallace (""Mr C Rolmane"")",male,45.0,0,0,111428,26.55,,S
783,0,1,"Long, Mr. Milton Clyde",male,29.0,0,0,113501,30.0,D6,S
723,0,2,"Gillespie, Mr. William Henry",male,34.0,0,0,12233,13.0,,S
171,0,1,"Van der hoef, Mr. Wyckoff",male,61.0,0,0,111240,33.5,B19,S
577,1,2,"Garside, Miss. Ethel",female,34.0,0,0,243880,13.0,,S
149,0,2,"Navratil, Mr. Michel (""Louis M Hoffman"")",male,36.5,0,2,230080,26.0,F2,S
35,0,1,"Meyer, Mr. Edgar Joseph",male,28.0,1,0,PC 17604,82.1708,,C
194,1,2,"Navratil, Master. Michel M",male,3.0,1,1,230080,26.0,F2,S
309,0,2,"Abelson, Mr. Samuel",male,30.0,1,0,P/PP 3381,24.0,,C
648,1,1,"Simonius-Blumer, Col. Oberst Alfons",male,56.0,0,0,13213,35.5,A26,C
433,1,2,"Louch, Mrs. Charles Alexander (Alice Adelaide Slow)",female,42.0,1,0,SC/AH 3085,26.0,,S
417,1,2,"Drew, Mrs. James Vivian (Lulu Thorne Christian)",female,34.0,1,1,28220,32.5,,S
186,0,1,"Rood, Mr. Hugh Roscoe",male,,0,0,113767,50.0,A32,S
296,0,1,"Lewy, Mr. Ervin G",male,,0,0,PC 17612,27.7208,,C
634,0,1,"Parr, Mr. William Henry Marsh",male,,0,0,112052,0.0,,S
755,1,2,"Herman, Mrs. Samuel (Jane Laver)",female,48.0,1,2,220845,65.0,,S
707,1,2,"Kelly, Mrs. Florence ""Fannie""",female,45.0,0,0,223596,13.5,,S
659,0,2,"Eitemiller, Mr. George Floyd",male,23.0,0,0,29751,13.0,,S
100,0,2,"Kantor, Mr. Sinai",male,34.0,1,0,244367,26.0,,S
858,1,1,"Daly, Mr. Peter Denis ",male,51.0,0,0,113055,26.55,E17,S
59,1,2,"West, Miss. Constance Mirium",female,5.0,1,2,C.A. 34651,27.75,,S
386,0,2,"Davies, Mr. Charles Henry",male,18.0,0,0,S.O.C. 14879,73.5,,S
727,1,2,"Renouf, Mrs. Peter Henry (Lillian Jefferys)",female,30.0,3,0,31027,21.0,,S
7,0,1,"McCarthy, Mr. Timothy J",male,54.0,0,0,17463,51.8625,E46,S
588,1,1,"Frolicher-Stehli, Mr. Maxmillian",male,60.0,1,1,13567,79.2,B41,C
738,1,1,"Lesurer, Mr. Gustave J",male,35.0,0,0,PC 17755,512.3292,B101,C
151,0,2,"Bateman, Rev. Robert James",male,51.0,0,0,S.O.P. 1166,12.525,,S
583,0,2,"Downton, Mr. William James",male,54.0,0,0,28403,26.0,,S
352,0,1,"Williams-Lambert, Mr. Fletcher Fellows",male,,0,0,113510,35.0,C128,S
548,1,2,"Padro y Manent, Mr. Julian",male,,0,0,SC/PARIS 2146,13.8625,,C
246,0,1,"Minahan, Dr. William Edward",male,44.0,2,0,19928,90.0,C78,Q
721,1,2,"Harper, Miss. Annie Jessie ""Nina""",female,6.0,0,1,248727,33.0,,S
374,0,1,"Ringhini, Mr. Sante",male,22.0,0,0,PC 17760,135.6333,,C
680,1,1,"Cardeza, Mr. Thomas Drake Martinez",male,36.0,0,1,PC 17755,512.3292,B51 B53 B55,C
313,0,2,"Lahtinen, Mrs. William (Anna Sylfven)",female,26.0,1,1,250651,26.0,,S
619,1,2,"Becker, Miss. Marion Louise",female,4.0,2,1,230136,39.0,F4,S
341,1,2,"Navratil, Master. Edmond Roger",male,2.0,1,1,230080,26.0,F2,S
792,0,2,"Gaskell, Mr. Alfred",male,16.0,0,0,239865,26.0,,S
274,0,1,"Natsch, Mr. Charles H",male,37.0,0,1,PC 17596,29.7,C118,C
660,0,1,"Newell, Mr. Arthur Webster",male,58.0,0,2,35273,113.275,D48,C
666,0,2,"Hickman, Mr. Lewis",male,32.0,2,0,S.O.C. 14879,73.5,,S
71,0,2,"Jenkin, Mr. Stephen Curnow",male,32.0,0,0,C.A. 33111,10.5,,S
440,0,2,"Kvillner, Mr. Johan Henrik Johannesson",male,31.0,0,0,C.A. 18723,10.5,,S
406,0,2,"Gale, Mr. Shadrach",male,34.0,1,0,28664,21.0,,S
661,1,1,"Frauenthal, Dr. Henry William",male,50.0,2,0,PC 17611,133.65,,S
450,1,1,"Peuchen, Major. Arthur Godfrey",male,52.0,0,0,113786,30.5,C104,S
708,1,1,"Calderhead, Mr. Edward Pennington",male,42.0,0,0,PC 17476,26.2875,E24,S
685,0,2,"Brown, Mr. Thomas William Solomon",male,60.0,1,1,29750,39.0,,S
304,1,2,"Keane, Miss. Nora A",female,,0,0,226593,12.35,E101,Q
551,1,1,"Thayer, Mr. John Borland Jr",male,17.0,0,2,17421,110.8833,C70,C
135,0,2,"Sobey, Mr. Samuel James Hayden",male,25.0,0,0,C.A. 29178,13.0,,S
508,1,1,"Bradley, Mr. George (""George Arthur Brayton"")",male,,0,0,111427,26.55,,S
696,0,2,"Chapman, Mr. Charles Henry",male,52.0,0,0,248731,13.5,,S
631,1,1,"Barkworth, Mr. Algernon Henry Wilson",male,80.0,0,0,27042,30.0,A23,S
63,0,1,"Harris, Mr. Henry Birkhardt",male,45.0,1,0,36973,83.475,C83,S
451,0,2,"West, Mr. Edwy Arthur",male,36.0,1,2,C.A. 34651,27.75,,S
712,0,1,"Klaber, Mr. Herman",male,,0,0,113028,26.55,C124,S
175,0,1,"Smith, Mr. James Clinch",male,56.0,0,0,17764,30.6958,A7,C
573,1,1,"Flynn, Mr. John Irwin (""Irving"")",male,36.0,0,0,PC 17474,26.3875,E25,S
746,0,1,"Crosby, Capt. Edward Gifford",male,70.0,1,1,WE/P 5735,71.0,B22,S
620,0,2,"Gavey, Mr. Lawrence",male,26.0,0,0,31028,10.5,,S
210,1,1,"Blank, Mr. Henry",male,40.0,0,0,112277,31.0,A31,C
735,0,2,"Troupiansky, Mr. Moses Aaron",male,23.0,0,0,233639,13.0,,S
507,1,2,"Quick, Mrs. Frederick Charles (Jane Richards)",female,33.0,0,2,26360,26.0,,S
346,1,2,"Brown, Miss. Amelia ""Mildred""",female,24.0,0,0,248733,13.0,F33,S
34,0,2,"Wheadon, Mr. Edward H",male,66.0,0,0,C.A. 24579,10.5,,S
156,0,1,"Williams, Mr. Charles Duane",male,51.0,0,1,PC 17597,61.3792,,C
715,0,2,"Greenberg, Mr. Samuel",male,52.0,0,0,250647,13.0,,S
10,1,2,"Nasser, Mrs. Nicholas (Adele Achem)",female,14.0,1,0,237736,30.0708,,C
884,0,2,"Banfield, Mr. Frederick James",male,28.0,0,0,C.A./SOTON 34068,10.5,,S
867,1,2,"Duran y More, Miss. Asuncion",female,27.0,1,0,SC/PARIS 2149,13.8583,,C
584,0,1,"Ross, Mr. John Hugo",male,36.0,0,0,13049,40.125,A10,C
474,1,2,"Jerwan, Mrs. Amin S (Marie Marthe Thuillard)",female,23.0,0,0,SC/AH Basle 541,13.7917,D,C
278,0,2,"Parkes, Mr. Francis ""Frank""",male,,0,0,239853,0.0,,S
536,1,2,"Hart, Miss. Eva Miriam",female,7.0,0,2,F.C.C. 13529,26.25,,S
150,0,2,"Byles, Rev. Thomas Roussel Davids",male,42.0,0,0,244310,13.0,,S
463,0,1,"Gee, Mr. Arthur H",male,47.0,0,0,111320,38.5,E63,S
485,1,1,"Bishop, Mr. Dickinson H",male,25.0,1,0,11967,91.0792,B49,C
371,1,1,"Harder, Mr. George Achilles",male,25.0,1,0,11765,55.4417,E50,C
340,0,1,"Blackwell, Mr. Stephen Weart",male,45.0,0,0,113784,35.5,T,S
547,1,2,"Beane, Mrs. Edward (Ethel Clarke)",female,19.0,1,0,2908,26.0,,S
333,0,1,"Graham, Mr. George Edward",male,38.0,0,1,PC 17582,153.4625,C91,S
476,0,1,"Clifford, Mr. George Quincy",male,,0,0,110465,52.0,A14,S
438,1,2,"Richards, Mrs. Sidney (Emily Hocking)",female,24.0,2,3,29106,18.75,,S
24,1,1,"Sloper, Mr. William Thompson",male,28.0,0,0,113788,35.5,A6,S
832,1,2,"Richards, Master. George Sibley",male,0.83,1,1,29106,18.75,,S
140,0,1,"Giglio, Mr. Victor",male,24.0,0,0,PC 17593,79.2,B86,C
464,0,2,"Milling, Mr. Jacob Christian",male,48.0,0,0,234360,13.0,,S
488,0,1,"Kent, Mr. Edward Austin",male,58.0,0,0,11771,29.7,B37,C
85,1,2,"Ilett, Miss. Bertha",female,17.0,0,0,SO/C 14885,10.5,,S
646,1,1,"Harper, Mr. Henry Sleeper",male,48.0,1,0,PC 17572,76.7292,D33,C
390,1,2,"Lehmann, Miss. Bertha",female,17.0,0,0,SC 1748,12.0,,C
191,1,2,"Pinsky, Mrs. (Rosa)",female,32.0,0,0,234604,13.0,,S
671,1,2,"Brown, Mrs. Thomas William Solomon (Elizabeth Catherine Ford)",female,40.0,1,1,29750,39.0,,S
36,0,1,"Holverson, Mr. Alexander Oskar",male,42.0,1,0,113789,52.0,,S
790,0,1,"Guggenheim, Mr. Benjamin",male,46.0,0,0,PC 17593,79.2,B82 B84,C
603,0,1,"Harrington, Mr. Charles H",male,,0,0,113796,42.4,,S
123,0,2,"Nasser, Mr. Nicholas",male,32.5,1,0,237736,30.0708,,C
881,1,2,"Shelley, Mrs. William (Imanita Parrish Hall)",female,25.0,0,1,230433,26.0,,S
318,0,2,"Moraweck, Dr. Ernest",male,54.0,0,0,29011,14.0,,S
222,0,2,"Bracken, Mr. James H",male,27.0,0,0,220367,13.0,,S
99,1,2,"Doling, Mrs. John T (Ada Julia Bone)",female,34.0,0,1,231919,23.0,,S
444,1,2,"Reynaldo, Ms. Encarnacion",female,28.0,0,0,230434,13.0,,S
138,0,1,"Futrelle, Mr. Jacques Heath",male,37.0,1,0,113803,53.1,C123,S
225,1,1,"Hoyt, Mr. Frederick Maxfield",male,38.0,1,0,19943,90.0,C93,S
200,0,2,"Yrois, Miss. Henriette (""Mrs Harbeck"")",female,24.0,0,0,248747,13.0,,S
182,0,2,"Pernot, Mr. Rene",male,,0,0,SC/PARIS 2131,15.05,,C
742,0,1,"Cavendish, Mr. Tyrell William",male,36.0,1,0,19877,78.85,C46,S
103,0,1,"White, Mr. Richard Frasar",male,21.0,0,1,35281,77.2875,D26,S
184,1,2,"Becker, Master. Richard F",male,1.0,2,1,230136,39.0,F4,S
702,1,1,"Silverthorne, Mr. Spencer Victor",male,35.0,0,0,PC 17475,26.2875,E24,S
597,1,2,"Leitch, Miss. Jessie Wills",female,,0,0,248727,33.0,,S
796,0,2,"Otter, Mr. Richard",male,39.0,0,0,28213,13.0,,S
98,1,1,"Greenfield, Mr. William Bertram",male,23.0,0,1,PC 17759,63.3583,D10 D12,C
552,0,2,"Sharp, Mr. Percival James R",male,27.0,0,0,244358,26.0,,S
400,1,2,"Trout, Mrs. William H (Jessie L)",female,28.0,0,0,240929,12.65,,S
125,0,1,"White, Mr. Percival Wayland",male,54.0,0,1,35281,77.2875,D26,S
111,0,1,"Porter, Mr. Walter Chamberlain",male,47.0,0,0,110465,52.0,C110,S
794,0,1,"Hoyt, Mr. William Fisher",male,,0,0,PC 17600,30.6958,,C
162,1,2,"Watt, Mrs. James (Elizabeth ""Bessie"" Inglis Milne)",female,40.0,0,0,C.A. 33595,15.75,,S
391,1,1,"Carter, Mr. William Ernest",male,36.0,1,2,113760,120.0,B96 B98,S
638,0,2,"Collyer, Mr. Harvey",male,31.0,1,1,C.A. 31921,26.25,,S
347,1,2,"Smith, Miss. Marion Elsie",female,40.0,0,0,31418,13.0,,S
729,0,2,"Bryhl, Mr. Kurt Arnold Gottfrid",male,25.0,1,0,236853,26.0,,S
332,0,1,"Partner, Mr. Austen",male,45.5,0,0,113043,28.5,C124,S
263,0,1,"Taussig, Mr. Emil",male,52.0,1,1,110413,79.65,E67,S
253,0,1,"Stead, Mr. William Thomas",male,62.0,0,0,113514,26.55,C87,S
616,1,2,"Herman, Miss. Alice",female,24.0,1,2,220845,65.0,,S
398,0,2,"McKane, Mr. Peter David",male,46.0,0,0,28403,26.0,,S
56,1,1,"Woolner, Mr. Hugh",male,,0,0,19947,35.5,C52,S
22,1,2,"Beesley, Mr. Lawrence",male,34.0,0,0,248698,13.0,D56,S
813,0,2,"Slemen, Mr. Richard James",male,35.0,0,0,28206,10.5,,S
273,1,2,"Mellinger, Mrs. (Elizabeth Anne Maidment)",female,41.0,0,1,250644,19.5,,S
299,1,1,"Saalfeld, Mr. Adolphe",male,,0,0,19988,30.5,C106,S
865,0,2,"Gill, Mr. John William",male,24.0,0,0,233866,13.0,,S
802,1,2,"Collyer, Mrs. Harvey (Charlotte Annie Tate)",female,31.0,1,1,C.A. 31921,26.25,,S
54,1,2,"Faunthorpe, Mrs. Lizzie (Elizabeth Anne Wilkinson)",female,29.0,1,0,2926,26.0,,S
419,0,2,"Matthews, Mr. William John",male,30.0,0,0,28228,13.0,,S
146,0,2,"Nicholls, Mr. Joseph Charles",male,19.0,1,1,C.A. 33112,36.75,,S
724,0,2,"Hodges, Mr. Henry Price",male,50.0,0,0,250643,13.0,,S
218,0,2,"Jacobsohn, Mr. Sidney Samuel",male,42.0,1,0,243847,27.0,,S
675,0,2,"Watson, Mr. Ennis Hastings",male,,0,0,239856,0.0,,S
706,0,2,"Morley, Mr. Henry Samuel (""Mr Henry Marshall"")",male,39.0,0,0,250655,26.0,,S
237,0,2,"Hold, Mr. Stephen",male,44.0,1,0,26707,26.0,,S
809,0,2,"Meyer, Mr. August",male,39.0,0,0,248723,13.0,,S
866,1,2,"Bystrom, Mrs. (Karolina)",female,42.0,0,0,236852,13.0,,S
608,1,1,"Daniel, Mr. Robert Williams",male,27.0,0,0,113804,30.5,,S
563,0,2,"Norman, Mr. Robert Douglas",male,28.0,0,0,218629,13.5,,S
545,0,1,"Douglas, Mr. Walter Donald",male,50.0,1,0,PC 17761,106.425,C86,C
431,1,1,"Bjornstrom-Steffansson, Mr. Mauritz Hakan",male,28.0,0,0,110564,26.55,C52,S
595,0,2,"Chapman, Mr. John Henry",male,37.0,1,0,SC/AH 29037,26.0,,S
663,0,1,"Colley, Mr. Edward Pomeroy",male,47.0,0,0,5727,25.5875,E58,S
890,1,1,"Behr, Mr. Karl Howell",male,26.0,0,0,111369,30.0,C148,C
875,1,2,"Abelson, Mrs. Samuel (Hannah Wizosky)",female,28.0,1,0,P/PP 3381,24.0,,C
855,0,2,"Carter, Mrs. Ernest Courtenay (Lilian Hughes)",female,44.0,1,0,244252,26.0,,S
756,1,2,"Hamalainen, Master. Viljo",male,0.67,1,1,250649,14.5,,S
248,1,2,"Hamalainen, Mrs. William (Anna)",female,24.0,0,2,250649,14.5,,S
528,0,1,"Farthing, Mr. John",male,,0,0,PC 17483,221.7792,C95,S
118,0,2,"Turpin, Mr. William John Robert",male,29.0,1,0,11668,21.0,,S
233,0,2,"Sjostedt, Mr. Ernst Adolf",male,59.0,0,0,237442,13.5,,S
362,0,2,"del Carlo, Mr. Sebastiano",male,29.0,1,0,SC/PARIS 2167,27.7208,,C
16,1,2,"Hewlett, Mrs. (Mary D Kingcome) ",female,55.0,0,0,248706,16.0,,S
134,1,2,"Weisz, Mrs. Leopold (Mathilde Francoise Pede)",female,29.0,1,0,228414,26.0,,S
546,0,1,"Nicholson, Mr. Arthur Ernest",male,64.0,0,0,693,26.0,,S
97,0,1,"Goldschmidt, Mr. George B",male,71.0,0,0,PC 17754,34.6542,A5,C
227,1,2,"Mellors, Mr. William John",male,19.0,0,0,SW/PP 751,10.5,,S
758,0,2,"Bailey, Mr. Percy Andrew",male,18.0,0,0,29108,11.5,,S
556,0,1,"Wright, Mr. George",male,62.0,0,0,113807,26.55,,S
818,0,2,"Mallet, Mr. Albert",male,31.0,1,1,S.C./PARIS 2079,37.0042,,C
249,1,1,"Beckwith, Mr. Richard Leonard",male,37.0,1,1,11751,52.5542,D35,S
849,0,2,"Harper, Rev. John",male,28.0,0,1,248727,33.0,,S
378,0,1,"Widener, Mr. Harry Elkins",male,27.0,0,2,113503,211.5,C82,C
527,1,2,"Ridsdale, Miss. Lucy",female,50.0,0,0,W./C. 14258,10.5,,S
31,0,1,"Uruchurtu, Don. Manuel E",male,40.0,0,0,PC 17601,27.7208,,C
260,1,2,"Parrish, Mrs. (Lutie Davis)",female,50.0,0,1,230433,26.0,,S
517,1,2,"Lemore, Mrs. (Amelia Milley)",female,34.0,0,0,C.A. 34260,10.5,F33,S
461,1,1,"Anderson, Mr. Harry",male,48.0,0,0,19952,26.55,E12,S
73,0,2,"Hood, Mr. Ambrose Jr",male,21.0,0,0,S.O.C. 14879,73.5,,S
441,1,2,"Hart, Mrs. Benjamin (Esther Ada Bloomfield)",female,45.0,1,1,F.C.C. 13529,26.25,,S
840,1,1,"Marechal, Mr. Pierre",male,,0,0,11774,29.7,C47,C
581,1,2,"Christy, Miss. Julie Rachel",female,25.0,1,1,237789,30.0,,S
801,0,2,"Ponesell, Mr. Martin",male,34.0,0,0,250647,13.0,,S
673,0,2,"Mitchell, Mr. Henry Michael",male,70.0,0,0,C.A. 24580,10.5,,S
453,0,1,"Foreman, Mr. Benjamin Laventall",male,30.0,0,0,113051,27.75,C111,C
713,1,1,"Taylor, Mr. Elmer Zebley",male,48.0,1,0,19996,52.0,C126,S
345,0,2,"Fox, Mr. Stanley Hubert",male,36.0,0,0,229236,13.0,,S
699,0,1,"Thayer, Mr. John Borland",male,49.0,1,1,17421,110.8833,C68,C
